id,label,contextual_agreement,contextual_factors,contextual_explanation,annotator,ambiguous_referent_type,ambiguous_referent_other_text,entity_reflection
51,correct,Disagree,"g. Evolving scientific evidence: The claims reflect different stages of scientific understanding.; l. Other: None of the listed factors explain the contradiction.; k. Ambiguous referent: One claim lacks a clear specification of species, population, dosage and exposure duration, or route of administration, resulting in uncertainty about the basis of comparison.",aaaaaaa,mengfei,Other; One or both abstracts lack species information,aaaaa,"Yes, the claims reflect the entities."
52,correct,Agree,Agree,,mengfei,,,"Yes, the claims reflect the entities."
53,correct,Disagree,"b. Population: The claims target different human subpopulations, such as differences in age, sex, genetic background, comorbidities, ethnicity, or risk profiles.",,mengfei,,,"Yes, the claims reflect the entities."
54,correct,Disagree,"b. Population: The claims target different human subpopulations, such as differences in age, sex, genetic background, comorbidities, ethnicity, or risk profiles.",,mengfei,,,"Yes, the claims reflect the entities."
55,incorrect,,,,mengfei,,,"Yes, the claims reflect the entities."
